,Name,Any_info,Genus,Species,Tested_for_Alkaloids,Ref_Alks,Alkaloids,Alkaloid_mainclass,Alkaloid_class,Alkaloid_class_notes,History_Antimalarial,Ref_H_Mal,History_Fever,Ref_H_Fever,Tested_Antimalarial,Extraction_Method,Type_of_Test,Activity_Antimalarial,Authors_Activity_Label,Positive_Control_Used,Given_Activities,Ref_Activity,General_notes,MPNS_notes,Details,Cardenolides,Cardenolides_details,Cardenolides_Ref,Steroids,Steroids_details,Steroids_Ref,General_Phytochem_notes,Family,Accepted_Name,Accepted_Species,Accepted_Species_ID,Accepted_ID,Accepted_Rank,Source
271,Malouetia bequaertiana Woodson,,Malouetia,bequaertiana Woodson,Yes,203,1.0,steroidal,steroidal; quarternary amine; pyrrolidine; ,,,,,,,,,,,,,,,,,,,,,,,,Apocynaceae,Malouetia bequaertiana,Malouetia bequaertiana,79890-1,79890-1,Species,Manual
272,Malouetia glandulifera Miers,,Malouetia,glandulifera Miers,Yes,203,1.0,steroidal,steroidal; simple amine,,,,,,,,,,,,,,,,,,,,,,,,Apocynaceae,Malouetia glandulifera,Malouetia glandulifera,79898-1,79898-1,Species,Manual
273,Malouetia tamaquarina (Aubl.) A. DC.,,Malouetia,tamaquarina (Aubl.) A. DC.,Yes,203,1.0,steroidal,steroidal; pyrrolidine,,,,,,,,,,,,,,,,,,,,,,,,Apocynaceae,Malouetia tamaquarina,Malouetia tamaquarina,79926-1,79926-1,Species,Manual
274,Mandevilla boliviensis (J. J. Veitch),spp. listed (1/179),Mandevilla,boliviensis (J. J. Veitch),Yes,144,1.0,,,,,,,,,,,,,,,,,,,,,,,,,,Apocynaceae,Mandevilla boliviensis,Mandevilla boliviensis,151935-2,151935-2,Species,Manual
275,Mandevilla illustris (Vell.) Woodson,,Mandevilla,illustris (Vell.) Woodson,,,,,,,,,,,,,,,,,,,,,,,,,1.0,steroid derivatives and their glycosides (rhizomes),"C115, C116",,Apocynaceae,Mandevilla illustris,Mandevilla illustris,151981-2,151981-2,Species,Manual
276,Mandevilla pentlandiana (DC.) Woodson,,Mandevilla,pentlandiana (DC.) Woodson,,,,,,,,,,,,,,,,,,,,,,1.0,"cardenolide glycosides, steroid glycoside derivatives (roots)","C113, C114",1.0,"cardenolide glycosides, steroid glycoside derivatives (roots)","C113, C114",,Apocynaceae,Mandevilla pentlandiana,Mandevilla pentlandiana,152033-2,152033-2,Species,Manual
277,Mandevilla pohliana (Stadelm.) A.H.Gentry,,Mandevilla,pohliana (Stadelm.) A.H.Gentry,,,,,,,,,,,,,,,,,,,,,,,,,1.0,steroid derivatives and their glycosides (rhizomes),"C117, C118","Species listed as Mandevilla velutina (synonym), C117, C118",Apocynaceae,Mandevilla pohliana,Mandevilla pohliana,280388-2,280388-2,Species,Manual
278,Marsdenia cundurango Rchb. f.,spp. listed (7/296),Marsdenia,cundurango Rchb. f.,Yes,205,1.0,Nicotinic acid ester on steroid,pyridine,,,,,,,,,,,,,,,,,,,,1.0,"Steroids, steroid glycosides (bark)",C119,,Apocynaceae,Marsdenia cundurango,Marsdenia cundurango,99126-1,99126-1,Species,Manual
279,Marsdenia edulis S. Watson,,Marsdenia,edulis S. Watson,Yes,154,1.0,,,,,,,,,,,,,,,,,,,,,,,,,,Apocynaceae,Marsdenia edulis,Marsdenia edulis,153556-2,153556-2,Species,Manual
280,Marsdenia flavescens A.Cunn. ex Hook.,,Marsdenia,flavescens A.Cunn. ex Hook.,,,,,,,,,,,,,,,,,,,,,,,,,1.0,Steroids (whole plant?),C128,,Apocynaceae,Marsdenia flavescens,Marsdenia flavescens,99150-1,99150-1,Species,Manual
281,Marsdenia formosana Masam.,,Marsdenia,formosana Masam.,,,,,,,,,,,,,,,,,,,,,,,,,1.0,Steroid glycosides (whole plant?),C136,,Apocynaceae,Marsdenia formosana,Marsdenia formosana,99153-1,99153-1,Species,Manual
282,Marsdenia gazensis S.Moore,,Marsdenia,gazensis S.Moore,,,,,,,,,,,,,,,,,,,,,,1.0,"Cardenolides, cardenolide glycosides (roots, wood)","C87, C88",,,,"Species listed as Gongronema gazense, C87, C88",Apocynaceae,Marsdenia gazensis,Marsdenia gazensis,99158-1,99158-1,Species,Manual
283,Marsdenia glabra Constantin,,Marsdenia,glabra Constantin,Yes,144,1.0,,,,,,,,,,,,,,,,,,,,,,,,,,Apocynaceae,Marsdenia glabra,Marsdenia glabra,99160-1,99160-1,Species,Manual
284,Marsdenia hainanensis Tsiang,,Marsdenia,hainanensis Tsiang,,,,,,,,,,,,,,,,,,,,,,,,,1.0,"Steroidal esters of nicotinic acid (stems, twigs)",C135,"Steroid ester alkaloids (stems, twigs), 135",Apocynaceae,Marsdenia hainanensis,Marsdenia hainanensis,99177-1,99177-1,Species,Manual
285,Marsdenia incisa P.T. Li & Y.H. Li,,Marsdenia,incisa P.T. Li & Y.H. Li,,,,,,,,,,,,,,,,,,,,,,,,,1.0,Steroid glycosides,C125,,Apocynaceae,Marsdenia incisa,Marsdenia incisa,900257-1,900257-1,Species,Manual
286,Marsdenia koi Tsiang,,Marsdenia,koi Tsiang,,,,,,,,,,,,,,,,,,,,,,,,,1.0,Steroid glycosides,C129,,Apocynaceae,Marsdenia koi,Marsdenia koi,99193-1,99193-1,Species,Manual
287,Marsdenia latifolia (Benth.) K. Schum,,Marsdenia,latifolia (Benth.) K. Schum,Yes,154,1.0,,,,1.0,"S, R [151]",,,Yes,Extraction,Vitro,1.0,Active,Yes,"IC50 = 36.27, 9.45 & 7.05 μg/mL (several frac. S & R, W2) 9.25 μg/mL (MeOH several frac. S & R, W2)",151,,,,,,,1.0,Steroid glycosides (leaves),C90,"Species listed as Gongronema latifolium (synonym), C90",Apocynaceae,Marsdenia latifolia,Marsdenia latifolia,99198-1,99198-1,Species,Manual
288,Marsdenia oreophila W.W. Sm.,,Marsdenia,oreophila W.W. Sm.,,,,,,,,,,,,,,,,,,,,,,,,,1.0,Steroid glycosides,"C130, 132",,Apocynaceae,Marsdenia oreophila,Marsdenia oreophila,99243-1,99243-1,Species,Manual
289,Marsdenia rostrata R. Br.,,Marsdenia,rostrata R. Br.,Yes,81,1.0,Nicotinic acid ester on steroid,steroidal; pyridine,,,,,,,,,,,,,,,,,,,,1.0,Steroidal esters of nicotinic acid (whole plant?),C127,"Steroid ester alkaloids (whole plant), C127",Apocynaceae,Marsdenia rostrata,Marsdenia rostrata,99275-1,99275-1,Species,Manual
290,Marsdenia roylei Wight,,Marsdenia,roylei Wight,,,,,,,,,,,,,,,,,,,,,,,,,1.0,"Steroids, steroid glycosides (stems)",C120,,Apocynaceae,Marsdenia roylei,Marsdenia roylei,99281-1,99281-1,Species,Manual
291,Marsdenia taylorii Schltr. & Rendle,,Marsdenia,taylorii Schltr. & Rendle,,,,,,,,,,,,,,,,,,,,,,,,,1.0,"Steroids, steroid glycosides (whole plant?)",C89,"Species listed as Gongronema taylorii (synonym), C89",Apocynaceae,Marsdenia taylorii,Marsdenia taylorii,99317-1,99317-1,Species,Manual
292,Marsdenia tenacissima (Roxb.) Moon,,Marsdenia,tenacissima (Roxb.) Moon,Yes,206,1.0,,,,,,,,,,,,,,,,,,,,,,1.0,"Steroids, steroid glycosides (stems (canes))","C121, 122, 123, 124",Many more refs available,Apocynaceae,Marsdenia tenacissima,Marsdenia tenacissima,99319-1,99319-1,Species,Manual
293,Marsdenia tinctoria R. Br.,,Marsdenia,tinctoria R. Br.,Yes,"144, C134",1.0,steroidal [C134],,,,,,,,,,,,,,,,,,,,,1.0,Steroidal esters of nicotinic acid (stems),C134,"Steroid ester alkaloids (stems), C134, and other alkaloids (whole plant) co-occur in this species, C255 ",Apocynaceae,Marsdenia tinctoria,Marsdenia tinctoria,99325-1,99325-1,Species,Manual
294,Marsdenia tomentosa C. Morren & Decne.,,Marsdenia,tomentosa C. Morren & Decne.,Yes,"C126, C131",1.0,"steroidal [C126, C131]",,,,,,,,,,,,,,,,,,,,,1.0,"Steroids, steroid glycosides, steroidal esters of nicotinic acid (leaves, stems (caules))","C126, C131","Steroid ester alkaloids (leaves, stems (caules)), C126, C131",Apocynaceae,Marsdenia tomentosa,Marsdenia tomentosa,99328-1,99328-1,Species,Manual
295,Melodinus acutiflorus F. Muell.,spp. listed (11/24),Melodinus,acutiflorus F. Muell.,Yes,211,1.0,,,,,,,,,,,,,,,,,,,,,,,,,,Apocynaceae,Melodinus acutiflorus,Melodinus acutiflorus,80158-1,80158-1,Species,Manual
296,Melodinus aeneus Baill.,,Melodinus,aeneus Baill.,Yes,210,1.0,MIA; pyridine; ,indole; indolizidine; pyridine; oxazole,,,,,,,,,,,,,,,,,,,,,,,,Apocynaceae,Melodinus aeneus,Melodinus aeneus,80160-1,80160-1,Species,Manual
297,Melodinus australis (F. Muell.) Pierre,,Melodinus,australis (F. Muell.) Pierre,Yes,210,1.0,MIA; indolizidine,indole; quarternary amine; quinolizidine; indolizidine,"unusual azabicyclononane structure, also 9-membered heterocycle",,,,,,,,,,,,,,,,,,,,,,,Apocynaceae,Melodinus australis,Melodinus australis,80164-1,80164-1,Species,Manual
298,Melodinus axillaris W. T. Wang,,Melodinus,axillaris W. T. Wang,Yes,210,1.0,MIA; pyridine;,indole; indolizidine; quinolizidine; piperidine; pyridine; oxazole,,,,,,,,,,,,,,,,,,,,,,,,Apocynaceae,Melodinus axillaris,Melodinus axillaris,80166-1,80166-1,Species,Manual
299,Melodinus balansae Baill.,,Melodinus,balansae Baill.,Yes,212,1.0,MIA,indole; indolizidine; quinolizidine; ,,,,,,,,,,,,,,,,,,,,,,,,Apocynaceae,Melodinus balansae,Melodinus balansae,80169-1,80169-1,Species,Manual
300,Melodinus cochinchinensis (Lour.) Merr.,,Melodinus,cochinchinensis (Lour.) Merr.,Yes,150,1.0,MIA,monoterpene; indole; indolizidine; peptide,"peptide essentially has carbonyl instead of connecting bond to complete an indole ring, unusual N atom in ring junction between 6 membered and 7 membered rings",,,,,,,,,,,,,,,,,,,,,,,Apocynaceae,Melodinus cochinchinensis,Melodinus cochinchinensis,80183-1,80183-1,Species,Manual
301,Melodinus fusiformis Champ. ex Benth.,,Melodinus,fusiformis Champ. ex Benth.,Yes,201,1.0,MIA,indole; indolizidine; quinolizidine,,,,,,,,,,,,,,,,,,,,,,,,Apocynaceae,Melodinus fusiformis,Melodinus fusiformis,80201-1,80201-1,Species,Manual
302,Melodinus philliraeoides Labill.,,Melodinus,philliraeoides Labill.,Yes,210,1.0,MIA; pyridine; ,indole; indolizidine; quinolizidine; pyridine; isoxazole; quinoline; tertiary amine,,,,,,,,,,,,,,,,,,,,,,,,Apocynaceae,Melodinus philliraeoides,Melodinus philliraeoides,80246-1,80246-1,Species,Manual
303,Melodinus reticulatus Boiteau,,Melodinus,reticulatus Boiteau,Yes,210,1.0,MIA,indole; indolizidine,,,,,,,,,,,,,,,,,,,,,,,,Apocynaceae,Melodinus reticulatus,Melodinus reticulatus,80249-1,80249-1,Species,Manual
304,Melodinus scandens J.R.Forst & G.Forst,,Melodinus,scandens J.R.Forst & G.Forst,Yes,209,1.0,MIA,indole; indolizidine; quinolizidine,,,,,,,,,,,,,,,,,,,,,,,,Apocynaceae,Melodinus scandens,Melodinus scandens,80253-1,80253-1,Species,Manual
305,Melodinus tenuicaudatus Tsiang & P. T. Li,,Melodinus,tenuicaudatus Tsiang & P. T. Li,Yes,208,1.0,MIA,indole; quinolizidine; indolizidine,,,,,,,,,,,,,,,,,,,,,,,,Apocynaceae,Melodinus tenuicaudatus,Melodinus tenuicaudatus,80259-1,80259-1,Species,Manual
306,Metastelma harleyi Fontella,spp. listed (1/100),Metastelma,harleyi Fontella,Yes,144,1.0,,,,,,,,,,,,,,,,,,,,,,,,,,Apocynaceae,Metastelma harleyi,Metastelma harleyi,280817-2,280817-2,Species,Manual
307,Microplumeria anomala (Müll. Arg.) Markgr.,All spp. listed (1/1),Microplumeria,anomala (Müll. Arg.) Markgr.,Yes,213,1.0,MIA,indole; indolizidine,,,,,,,,,,,,,,,,,,,,,,,,Apocynaceae,Microplumeria anomala,Microplumeria anomala,80344-1,80344-1,Species,Manual
308,Minaria magisteriana (Rapini) T. U. P. Konno & Rapini,spp. listed (1/22),Minaria,magisteriana (Rapini) T. U. P. Konno & Rapini,Yes,144,1.0,,,,,,,,,,,,,,,,,,,,,,,,,,Apocynaceae,Minaria magisteriana,Minaria magisteriana,77074595-1,77074595-1,Species,Manual
309,Mondia whitei (Hook. f.) Skeels,spp. listed (1/2),Mondia,whitei (Hook. f.) Skeels,,,,,,,1.0,R [103],,,Yes,Extraction,Vitro,0.0,Inactive,Yes,"IC50 > 1000 μg/mL (50% EtOH R, 3D7)",214,,,,,,,,,,,Apocynaceae,Mondia whitei,Mondia whitei,99812-1,99812-1,Species,Manual
310,Monolluma quadrangula (Forssk.) Plowes,spp. listed (1/5),Monolluma,quadrangula (Forssk.) Plowes,,,,,,,,,,,Yes,Extraction,Vitro,0.0,,Yes,"IC50 = 27.5  ± 4.3 μg/mL (MeOH U, K1)",173,,,,,,,1.0,Steroid glycosides (aerial parts),C241,"Species listed as Caralluma quandrangula (synonym), C241",Apocynaceae,Monolluma quadrangula,Monolluma quadrangula,986817-1,986817-1,Species,Manual
311,Motandra paniculata (Poir.) I. M. Turner,spp. listed (1/3),Motandra,paniculata (Poir.) I. M. Turner,,,,,,,1.0,L [147],,,Yes,Extraction,Vitro,0.0,Weak,Yes,"IC50 = 16.3 ± 1.8 μg/mL (EtOH U, FcB1)",147,,,,,,,,,,,Apocynaceae,Motandra paniculata,Motandra paniculata,77158413-1,77158413-1,Species,Manual
312,Myriopteron extensum (Wight) K.Schum.,NRIF (1 sp.),Myriopteron,extensum (Wight) K.Schum.,,,,,,,,,,,,,,,,,,,,,,1.0,"Cardenolide glycosides, steroid glycosides (pericarps, roots, whole plant)","C137, C138, C139",1.0,"Cardenolide glycosides, steroid glycosides (pericarps, roots, whole plant)","C137, C138, C139",,Apocynaceae,Myriopteron extensum,Myriopteron extensum,99829-1,99829-1,Species,Manual
313,Nerium oleander L.,All spp. listed (1/1),Nerium,oleander L.,Yes,116,1.0,,,,1.0,[79],1.0,[79],,,,,,,,,,,,1.0,"Cardenolides, cardenolide glycosides, steroids (leaves, root bark, stems, twigs, wood?)","C5, C140, C141, C142, C143, C144",1.0,"Cardenolides, cardenolide glycosides, steroids (leaves, root bark, stems, twigs, wood?)","C5, C140, C141, C142, C143, C144","Species listed as Nerium odorum (synonym), C5, C144",Apocynaceae,Nerium oleander,Nerium oleander,80460-1,80460-1,Species,Manual
314,Ochrosia acuminata Trimen ex Valeton,spp. listed (14/44),Ochrosia,acuminata Trimen ex Valeton,Yes,219,1.0,MIA; indole;,indole; quinolizidine; isoquinoline,,,,,,,,,,,,,,,,,,,,,,,,Apocynaceae,Ochrosia acuminata,Ochrosia acuminata,80487-1,80487-1,Species,Manual
315,Ochrosia alyxioides Guillaumin,,Ochrosia,alyxioides Guillaumin,Yes,225,1.0,,,,,,,,,,,,,,,,,,,,,,,,,,Apocynaceae,Ochrosia alyxioides,Ochrosia alyxioides,80488-1,80488-1,Species,Manual
316,Ochrosia borbonica J. F. Gmel.,,Ochrosia,borbonica J. F. Gmel.,Yes,217,1.0,MIA,indole; quinolizidine,,,,,,,,,,,,,,,,,,,,,,,,Apocynaceae,Ochrosia borbonica,Ochrosia borbonica,80491-1,80491-1,Species,Manual
317,Ochrosia compta K. Schum.,,Ochrosia,compta K. Schum.,Yes,222,1.0,MIA,indole; indolizidine; quarternary amine; ,,,,,,,,,,,,,,,,,,,,,,,,Apocynaceae,Ochrosia compta,Ochrosia compta,80497-1,80497-1,Species,Manual
318,Ochrosia elliptica Labill.,,Ochrosia,elliptica Labill.,Yes,216,1.0,MIA; indole,indole; quinolizidine,8-membered ring w/ N atom (with 2 atom bridge - N atom as rin-junction),,,,,,,,,,,,,,,,,,,,,,,Apocynaceae,Ochrosia elliptica,Ochrosia elliptica,80500-1,80500-1,Species,Manual
319,Ochrosia glomerata (Blume) F. Muell,,Ochrosia,glomerata (Blume) F. Muell,,,,,,,,,,,Yes,Extraction,Vitro,1.0,Active,Yes,"IC50 = 2.7 & 7.1 μg/mL (MeOH R, D6 & W2)",215,,,,,,,,,,,Apocynaceae,Ochrosia glomerata,Ochrosia glomerata,77177054-1,77177054-1,Species,Manual
320,Ochrosia lifuana Guillaumin,,Ochrosia,lifuana Guillaumin,Yes,KN,1.0,bisindole,,,,,,,,,,,,,,,,,,,,,,,,,Apocynaceae,Ochrosia lifuana,Ochrosia lifuana,80519-1,80519-1,Species,Manual
321,Ochrosia miana Baill. ex Guillaumin,,Ochrosia,miana Baill. ex Guillaumin,Yes,"KN, 220",1.0,bisindole [KN]; MIA,indole; quinolizidine,,,,,,,,,,,,,,,,,,,,,,,,Apocynaceae,Ochrosia miana,Ochrosia miana,80524-1,80524-1,Species,Manual
322,Ochrosia moorei (F. Muell.) Benth.,,Ochrosia,moorei (F. Muell.) Benth.,Yes,226,1.0,MIA; indole,indole; pyridine; isoquinoline,,,,,,Yes,Isolation,Vitro,1.0,,,"IC50 = 0.007 μM (aspidocarpine, MDR K1) [IC50 = 0.0 μg/mL]",258,Compound only tested,,,,,,,,,,Apocynaceae,Ochrosia moorei,Ochrosia moorei,80527-1,80527-1,Species,Manual
323,Ochrosia mulsantii Montrouz.,,Ochrosia,mulsantii Montrouz.,Yes,218,1.0,indole; MIA,indole; quinolizidine; isoquinoline,,,,,,,,,,,,,,,,,,,,,,,,Apocynaceae,Ochrosia mulsantii,Ochrosia mulsantii,80528-1,80528-1,Species,Manual
324,Ochrosia nakaiana (Koidz.) Koidz. ex H. Hara,,Ochrosia,nakaiana (Koidz.) Koidz. ex H. Hara,Yes,224,1.0,MIA; ,indole; piperidine; quinolizidine; monoterpenoid; quarternary amine,,,,,,,,,,,,,,,,,,,,,,,,Apocynaceae,Ochrosia nakaiana,Ochrosia nakaiana,80530-1,80530-1,Species,Manual
325,Ochrosia oppositifolia (Lam.) K. Schum.,,Ochrosia,oppositifolia (Lam.) K. Schum.,Yes,201,1.0,beta carboline?,indole; pyridine,,,,,,,,,,,,,,,,,,,,,,,,Apocynaceae,Ochrosia oppositifolia,Ochrosia oppositifolia,80534-1,80534-1,Species,Manual
326,Ochrosia poweri F. M. Bailey,,Ochrosia,poweri F. M. Bailey,Yes,"KN, 223",1.0,MIA,indole; quinolizidine,,,,,,,,,,,,,,,,,,,,,,,,Apocynaceae,Ochrosia poweri,Ochrosia poweri,80538-1,80538-1,Species,Manual
327,Ochrosia silvatica Däniker,,Ochrosia,silvatica Däniker,Yes,221,1.0,indole; MIA,indole; isoquinoline; quinolizidine,8-membered ring w/ N atom (with 2 atom bridge - N atom as rin-junction),,,,,,,,,,,,,,,,,,,,,,,Apocynaceae,Ochrosia silvatica,Ochrosia silvatica,80545-1,80545-1,Species,Manual
328,Oncinotis nitida Benth.,spp. listed (2/7),Oncinotis,nitida Benth.,Yes,228,1.0,spermidine,spermidine,seventeen membered lactam ring; ,,,,,,,,,,,,,,,,,,,,,,,Apocynaceae,Oncinotis nitida,Oncinotis nitida,80635-1,80635-1,Species,Manual
329,Oncinotis tenuiloba Stapf,,Oncinotis,tenuiloba Stapf,Yes,227,1.0,spermidine,spermidine,,,,,,,,,,,,,,,,,,,,,,,,Apocynaceae,Oncinotis tenuiloba,Oncinotis tenuiloba,80641-1,80641-1,Species,Manual
330,Orbea variegata (L.) Haw.,NRIF (60 spp.),Orbea,variegata (L.) Haw.,,,,,,,,,,,,,,,,,,,,,,,,,1.0,Steroid glycosides (aerial parts),"C180, C224","Species listed as Stapelia variegata (synonym), C180, C224",Apocynaceae,Orbea variegata,Orbea variegata,99924-1,99924-1,Species,Manual
331,Orthanthera viminea Wight,NRIF (6 spp.),Orthanthera,viminea Wight,,,,,,,,,,,,,,,,,,,,,,,,,1.0,"Steroids, steroid glycosides (twigs)","C145, C146","Genus listed as Orthenthera, C145, C146 ",Apocynaceae,Orthanthera viminea,Orthanthera viminea,99950-1,99950-1,Species,Manual
332,Oxypetalum banksii R. Br. ex Schult.,spp. listed (1/135),Oxypetalum,banksii R. Br. ex Schult.,Yes,53,1.0,,,,,,,,,,,,,,,,,,,,,,,,,,Apocynaceae,Oxypetalum banksii,Oxypetalum banksii,179274-2,179274-2,Species,Manual
333,Oxystelma esculentum (L. f.) Sm.,spp. listed (1/2),Oxystelma,esculentum (L. f.) Sm.,,,,,,,,,,,,,,,,,,,,,,1.0,"Cardenolide glycosides, steroid glycosides (leaves, roots)","C147, C148, C149",1.0,"Cardenolide glycosides, steroid glycosides (leaves, roots)","C147, C148, C149",,Apocynaceae,Oxystelma esculentum,Oxystelma esculentum,60458242-2,60458242-2,Species,Manual
334,Pachycarpus distinctus (N. E. Br) Bullock,spp. listed (3/39),Pachycarpus,distinctus (N. E. Br) Bullock,,,,,,,,,,,,,,,,,,,,,,1.0,"Cardenolides, cardenolide glycosides (roots)",C150,,,,,Apocynaceae,Pachycarpus distinctus,Pachycarpus distinctus,100226-1,100226-1,Species,Manual
335,Pachycarpus lineolatus (Decne.) Bullock,,Pachycarpus,lineolatus (Decne.) Bullock,,,,,,,,,,,,,,,,,,,,,,,,,1.0,Steroids (roots),C152,,Apocynaceae,Pachycarpus lineolatus,Pachycarpus lineolatus,100241-1,100241-1,Species,Manual
336,Pachycarpus schinzianus (Schltr.) N. E. Br.,,Pachycarpus,schinzianus (Schltr.) N. E. Br.,,,,,,,,,,,,,,,,,,,,,,1.0,"Cardenolides, cardenolide glycosides (roots, seeds)",C151,,,,,Apocynaceae,Pachycarpus schinzianus,Pachycarpus schinzianus,100257-1,100257-1,Species,Manual
337,Pachypodium lamerei Drake,spp. listed (1/22),Pachypodium,lamerei Drake,Yes,229,1.0,,,,,,,,,,,,,,,,,,,,,,,,,,Apocynaceae,Pachypodium lamerei,Pachypodium lamerei,80705-1,80705-1,Species,Manual
338,Parahancornia fasciculata (Poir.) Benoist,spp. listed (1/7),Parahancornia,fasciculata (Poir.) Benoist,Yes,230,1.0,MIA,indole; quinolizidine,,1.0,[42],,,Yes,Isolation,Vitro,0.0,Weak,Yes,"IC50 > 62.0 ± 1.92 μM (lupeol,W2)",42,lupeol (& its synthesised derivatives) are NOT alkaloids,,,,,,,,,,Apocynaceae,Parahancornia fasciculata,Parahancornia fasciculata,182946-2,182946-2,Species,Manual
339,Parepigynum funingense Tsiang et P. T. Li,All spp. listed (1/1),Parepigynum,funingense Tsiang et P. T. Li,,,,,,,,,,,,,,,,,,,,,,1.0,"Cardenolides, cardenolide glycosides, cardanolides, cardanolide glycosides (roots)","C153, C154, C155, C156",,,,,Apocynaceae,Parepigynum funingense,Parepigynum funingense,80864-1,80864-1,Species,Manual
340,Parsonsia alboflavescens (Denst.) Mabb.,spp. listed (5/85),Parsonsia,alboflavescens (Denst.) Mabb.,Yes,"KN, 143",1.0,spermidine,,homospermidine,,,,,,,,,,,,,,,,,,,,,,,Apocynaceae,Parsonsia alboflavescens,Parsonsia alboflavescens,80868-1,80868-1,Species,Manual
341,Parsonsia eucalyptophylla F. Muell.,,Parsonsia,eucalyptophylla F. Muell.,Yes,"KN, 143",1.0,pyrrolizidine,pyrrolizidine,,,,,,,,,,,,,,,,,,,,,,,,Apocynaceae,Parsonsia eucalyptophylla,Parsonsia eucalyptophylla,80910-1,80910-1,Species,Manual
342,Parsonsia heterophylla A. Cunn.,,Parsonsia,heterophylla A. Cunn.,Yes,"KN, 143",1.0,pyrrolizidine,pyrrolizidine,,,,,,,,,,,,,,,,,,,,,,,,Apocynaceae,Parsonsia heterophylla,Parsonsia heterophylla,80926-1,80926-1,Species,Manual
343,Parsonsia oligantha (K. Schum.) D. J. Middleton,,Parsonsia,oligantha (K. Schum.) D. J. Middleton,Yes,143,1.0,,,,,,,,,,,,,,,,,,,,,,,,,,Apocynaceae,Parsonsia oligantha,Parsonsia oligantha,995742-1,995742-1,Species,Manual
344,Parsonsia straminea (R. Br.) F. Muell,,Parsonsia,straminea (R. Br.) F. Muell,Yes,"KN, 143",1.0,pyrrolizidine,pyrrolizidine,,,,,,,,,,,,,,,,,,,,,,,,Apocynaceae,Parsonsia straminea,Parsonsia straminea,50061-3,50061-3,Species,Manual
345,Pattalias palustris (Pursh) Fishbein,spp. listed (1/2),Pattalias,palustris (Pursh) Fishbein,Yes,144,1.0,,,,,,,,,,,,,,,,,,,,,,,,,,Apocynaceae,Pattalias palustris,Pattalias palustris,77174448-1,77174448-1,Species,Manual
346,Pentalinon andrieuxii (Müll. Arg.) B. F. Hansen & Wunderlin,spp. listed (2/2),Pentalinon,andrieuxii (Müll. Arg.) B. F. Hansen & Wunderlin,,,,,,,,,,,Yes,Isolation,Vitro,0.0,Active,Yes,"IC50 = 22.5 μM (betulinic acid, F32) [IC50 = 10.3 μg/mL]",231,Compound tested,,,,,,1.0,"Steroids, one steroid glycoside (roots)",C157,,Apocynaceae,Pentalinon andrieuxii,Pentalinon andrieuxii,942488-1,942488-1,Species,Manual
347,Pentalinon luteum (L.) B.F.Hansen & Wunderlin,,Pentalinon,luteum (L.) B.F.Hansen & Wunderlin,,,,,,,,,,,,,,,,,,,,,,1.0,Cardenolide glycosides (leaves),C158,,,,"species listed as Urechites lutea, probably Urechites luteum (synonym), C158",Apocynaceae,Pentalinon luteum,Pentalinon luteum,942487-1,942487-1,Species,Manual
348,Pentatropis capensis (L. f.) Bullock,spp. listed (1/4),Pentatropis,capensis (L. f.) Bullock,Yes,119,1.0,,,,,,,,,,,,,,,,,,,,,,,,,,Apocynaceae,Pentatropis capensis,Pentatropis capensis,100315-1,100315-1,Species,Manual
349,Pentopetia albicans (Jum. & H. Perrier) Klack.,spp. listed (1/23),Pentopetia,albicans (Jum. & H. Perrier) Klack.,Yes,284,0.0,,,,,,,,,,,,,,,,,,,,,,,,,,Apocynaceae,Pentopetia albicans,Pentopetia albicans,1011612-1,1011612-1,Species,Manual
350,Pentopetia androsaemifolia Decne.,,Pentopetia,androsaemifolia Decne.,,,,,,,,,,,,,,,,,,,,,,1.0,"One cardenolide, one cardenolide glycoside",C159,,,,,Apocynaceae,Pentopetia androsaemifolia,Pentopetia androsaemifolia,100332-1,100332-1,Species,Manual
351,Peplonia adnata (E. Fourn.) U. C. S. Silva & Rapini,spp. listed (2/9),Peplonia,adnata (E. Fourn.) U. C. S. Silva & Rapini,Yes,144,1.0,,,,,,,,,,,,,,,,,,,,,,,,,,Apocynaceae,Peplonia adnata,Peplonia adnata,77130384-1,77130384-1,Species,Manual
352,Peplonia axillaris (Vell.) Fontella & Rapini,,Peplonia,axillaris (Vell.) Fontella & Rapini,Yes,53,1.0,,,,,,,,,,,,,,,,,,,,,,,,,,Apocynaceae,Peplonia axillaris,Peplonia axillaris,77064982-1,77064982-1,Species,Manual
353,Pergularia daemia (Forssk.) Chiov.,All spp. listed (2/2),Pergularia,daemia (Forssk.) Chiov.,Yes,119,1.0,,,,1.0,"R, L [148]",,,Yes,Extraction,Vitro,0.0,Inactive,Yes,"IC50 = 203.8 & 244.1 μg/mL (MeOH B, 3D7 & K1)",165,,,,1.0,"Cardenolides, cardenolide glycoside (resin?)",C160,,,,,Apocynaceae,Pergularia daemia,Pergularia daemia,100371-1,100371-1,Species,Manual
354,Pergularia daemia subsp. daemia,,Pergularia,daemia subsp. daemia,Yes,234,1.0,,,,,,,,,,,,,,,,,,,1.0,"Cardenolides, cardenolide glycoside (resin?)",C160,,,,"accepted subspecies, listed as Pergularia extensa (synonym), C160",Apocynaceae,Pergularia daemia subsp. daemia,Pergularia daemia,100371-1,77172919-1,Subspecies,Manual
355,Pergularia tomentosa L.,,Pergularia,tomentosa L.,Yes,235,1.0,,,,,,,,,,,,,,,,,,,1.0,"Cardenolides, cardenolide glycosides (roots)","C161, 162",,,,,Apocynaceae,Pergularia tomentosa,Pergularia tomentosa,100411-1,100411-1,Species,Manual
356,Periploca calophylla (Wight) Falc.,,Periploca,calophylla (Wight) Falc.,,,,,,,,,,,,,,,,,,,,,,,,,1.0,"Steroids, steroid glycosides (twigs)","C169, C170",,Apocynaceae,Periploca calophylla,Periploca calophylla,100435-1,100435-1,Species,Manual
357,"Periploca chrysantha D.S. Yao, X.D. Chen & J.W. Ren",,Periploca,"chrysantha D.S. Yao, X.D. Chen & J.W. Ren",,,,,,,,,,,,,,,,,,,,,,,,,1.0,Steroid glycosides (root bark),C172,,Apocynaceae,Periploca chrysantha,Periploca chrysantha,20007318-1,20007318-1,Species,Manual
358,Periploca forrestii Schltr.,,Periploca,forrestii Schltr.,,,,,,,,,,,,,,,,,,,,,,1.0,"Cardenolide glycosides, steroid glycosides (roots)",C164,1.0,"Cardenolide glycosides, steroid glycosides (roots)",C164,,Apocynaceae,Periploca forrestii,Periploca forrestii,100454-1,100454-1,Species,Manual
359,Periploca graeca L.,,Periploca,graeca L.,,,,,,,,,,,,,,,,,,,,,,,,,1.0,Steroid glycosides (branches),C171,,Apocynaceae,Periploca graeca,Periploca graeca,100459-1,100459-1,Species,Manual
360,Periploca hydaspidis Falc.,spp. listed (3/17),Periploca,hydaspidis Falc.,Yes,236,1.0,,,,,,,,,,,,,,,,,,,,,,,,,,Apocynaceae,Periploca hydaspidis,Periploca hydaspidis,100463-1,100463-1,Species,Manual
361,Periploca linearifolia Quart.-Dill. & A. Rich,,Periploca,linearifolia Quart.-Dill. & A. Rich,,,,,,,1.0,B [103],,,Yes,Extraction,Vitro,0.0,Inactive,Yes,"IC50 > 100 μg/mL (aq RB, D6 & W2)",34,,,,,,,,,,,Apocynaceae,Periploca linearifolia,Periploca linearifolia,100470-1,100470-1,Species,Manual
362,Periploca sepium Bunge,,Periploca,sepium Bunge,,,,,,,,,,,,,,,,,,,,,,1.0,"Cardenolides, cardenolide glycosides, steroids, steroid glycosides (root bark, whole plant)","C164, C165, C166, C167, C168",1.0,"Cardenolides, cardenolide glycosides, steroids, steroid glycosides (root bark, whole plant)","C164, C165, C166, C167, C168",many more refs available,Apocynaceae,Periploca sepium,Periploca sepium,100502-1,100502-1,Species,Manual
363,Periploca somaliensis Browicz,,Periploca,somaliensis Browicz,,,,,,,,,,,Yes,Extraction,Vitro,0.0,Inactive,Yes,"IC50 > 12.5 μg/mL (MeOH A, K1)",91,Quoted as inactive,,,,,,,,,,Apocynaceae,Periploca somaliensis,Periploca somaliensis,100504-1,100504-1,Species,Manual
364,Petchia ceylanica (Wight) Livera,spp. listed (3/8),Petchia,ceylanica (Wight) Livera,Yes,238,1.0,MIA,indole; indolizidine,,,,,,,,,,,,,,,,,,,,,,,,Apocynaceae,Petchia ceylanica,Petchia ceylanica,81104-1,81104-1,Species,Manual
